{
  "manufacturer": "ACER",
  "aliases": [
    "ACER INC"
  ],
  "officialDomains": [
    "acer.com",
    "global-download.acer.com"
  ],
  "genericRules": {
    "enabled": true,
    "supportPageTemplates": [
      "https://www.acer.com/us-en/support/drivers-and-manuals?search={modelEncoded}"
    ],
    "revisionPageTemplates": [],
    "searchPageTemplates": [],
    "directDownloadPathHints": [
      "BIOS",
      "Firmware",
      "UEFI",
      "support",
      "download"
    ],
    "slugVariants": [
      "{slug}",
      "{slugLower}",
      "{slugUpper}",
      "{modelEncoded}",
      "{modelNoSpaces}"
    ],
    "notes": [
      "Для Acer лучше SNID/part number; модельный поиск является fallback."
    ],
    "confidence": "template",
    "lastChecked": null,
    "source": "generic_vendor_template",
    "safeForDirectDownload": false
  },
  "models": [],
  "catalogVersion": "2.1.0",
  "updatedAt": "2026-06-30",
  "dataPolicy": {
    "storesBiosBinaries": false,
    "officialDomainsOnly": true,
    "biosDownloadThroughProxyAllowed": false,
    "safeRequiresFileVerification": true
  }
}
