{
  "manufacturer": "ECS",
  "aliases": [],
  "officialDomains": [
    "ecs.com.tw",
    "elitegroupcomputer.com"
  ],
  "genericRules": {
    "enabled": true,
    "supportPageTemplates": [
      "https://www.ecs.com.tw/en/Product/Search?keyword={modelEncoded}"
    ],
    "revisionPageTemplates": [],
    "searchPageTemplates": [],
    "directDownloadPathHints": [
      "BIOS",
      "Firmware",
      "UEFI",
      "support",
      "download"
    ],
    "slugVariants": [
      "{slug}",
      "{slugLower}",
      "{slugUpper}",
      "{modelEncoded}",
      "{modelNoSpaces}"
    ],
    "notes": []
  },
  "models": []
}