{
  "manufacturer": "COLORFUL",
  "aliases": [],
  "officialDomains": [
    "colorful.cn",
    "en.colorful.cn",
    "colorfulgroup.com"
  ],
  "genericRules": {
    "enabled": true,
    "supportPageTemplates": [
      "https://en.colorful.cn/en/home/ProductSearch?keyword={modelEncoded}",
      "https://www.colorful.cn/home/Search?keyword={modelEncoded}"
    ],
    "revisionPageTemplates": [],
    "searchPageTemplates": [],
    "directDownloadPathHints": [
      "BIOS",
      "Firmware",
      "UEFI",
      "support",
      "download"
    ],
    "slugVariants": [
      "{slug}",
      "{slugLower}",
      "{slugUpper}",
      "{modelEncoded}",
      "{modelNoSpaces}"
    ],
    "notes": []
  },
  "models": []
}