{
  "manufacturer": "NZXT",
  "aliases": [],
  "officialDomains": [
    "nzxt.com"
  ],
  "genericRules": {
    "enabled": true,
    "supportPageTemplates": [
      "https://support.nzxt.com/hc/en-us/search?query={modelEncoded}"
    ],
    "revisionPageTemplates": [],
    "searchPageTemplates": [],
    "directDownloadPathHints": [
      "BIOS",
      "Firmware",
      "UEFI",
      "support",
      "download"
    ],
    "slugVariants": [
      "{slug}",
      "{slugLower}",
      "{slugUpper}",
      "{modelEncoded}",
      "{modelNoSpaces}"
    ],
    "notes": []
  },
  "models": []
}